{
  "$schema": "https://json-schema.org/draft/2020-12/schema",
  "$id": "https://agenttalk.local/schemas/plan_manifest.schema.json",
  "title": "PlanManifest",
  "type": "object",
  "additionalProperties": true,
  "required": ["schema_version", "plan_id", "created_at", "agents", "deliverables"],
  "properties": {
    "schema_version": { "type": "string", "pattern": "^[0-9]+\\.[0-9]+$" },
    "plan_id": { "type": "string", "minLength": 1 },
    "plan_name": { "type": ["string", "null"] },
    "created_at": { "type": "string", "format": "date-time" },
    "agents": {
      "type": "array",
      "items": {
        "type": "object",
        "additionalProperties": true,
        "required": ["agent_id", "required"],
        "properties": {
          "agent_id": { "type": "string", "minLength": 1 },
          "required": { "type": "boolean" }
        }
      }
    },
    "tasks": { "type": ["array", "null"], "items": { "type": "object", "additionalProperties": true } },
    "deliverables": {
      "type": "array",
      "minItems": 1,
      "items": {
        "type": "object",
        "additionalProperties": true,
        "required": ["name"],
        "properties": {
          "name": { "type": "string", "minLength": 1 },
          "from_task_id": { "type": ["string", "null"] },
          "accept_if": { "type": ["object", "null"], "additionalProperties": true }
        }
      }
    },
    "policies": { "type": ["object", "null"], "additionalProperties": true }
  }
}

